{
  "schema_version": 1,
  "generated_at": "2026-10-03T02:03:24Z",
  "collector": {
    "name": "sitetus-node",
    "version": "0.1.0",
    "lang": "node",
    "file_hash": "52f2dffdef04fce1f1d7b0b5755e4ba8e348f15bc8fc1e41e62440eaa3ec988d"
  },
  "project_key": "exampleprojectkey001",
  "mode": "monitor",
  "level": 1,
  "runtime": {
    "node_version": "22.12.0",
    "sapi": "node",
    "platform": "win32"
  },
  "framework": {
    "detected": "express",
    "name": "Express",
    "version": "4.22.3",
    "detection_method": "lockfile"
  },
  "meta": {
    "warnings": [],
    "duration_ms": 9,
    "root_path_source": "default"
  },
  "packages": {
    "ecosystem": "npm",
    "source": "package-lock.json",
    "lock_hash": "2fe0d128d4fd0bb119f07c9ad077eb2bef631c34c472917290e5169fbddb34b5",
    "items": [
      {
        "name": "@esbuild/aix-ppc64",
        "version": "0.27.7",
        "dev": true
      },
      {
        "name": "@esbuild/android-arm",
        "version": "0.27.7",
        "dev": true
      },
      {
        "name": "@esbuild/android-arm64",
        "version": "0.27.7",
        "dev": true
      },
      {
        "name": "@esbuild/android-x64",
        "version": "0.27.7",
        "dev": true
      },
      {
        "name": "@esbuild/darwin-arm64",
        "version": "0.27.7",
        "dev": true
      },
      {
        "name": "@esbuild/darwin-x64",
        "version": "0.27.7",
        "dev": true
      },
      {
        "name": "@esbuild/freebsd-arm64",
        "version": "0.27.7",
        "dev": true
      },
      {
        "name": "@esbuild/freebsd-x64",
        "version": "0.27.7",
        "dev": true
      },
      {
        "name": "@esbuild/linux-arm",
        "version": "0.27.7",
        "dev": true
      },
      {
        "name": "@esbuild/linux-arm64",
        "version": "0.27.7",
        "dev": true
      },
      {
        "name": "@esbuild/linux-ia32",
        "version": "0.27.7",
        "dev": true
      },
      {
        "name": "@esbuild/linux-loong64",
        "version": "0.27.7",
        "dev": true
      },
      {
        "name": "@esbuild/linux-mips64el",
        "version": "0.27.7",
        "dev": true
      },
      {
        "name": "@esbuild/linux-ppc64",
        "version": "0.27.7",
        "dev": true
      },
      {
        "name": "@esbuild/linux-riscv64",
        "version": "0.27.7",
        "dev": true
      },
      {
        "name": "@esbuild/linux-s390x",
        "version": "0.27.7",
        "dev": true
      },
      {
        "name": "@esbuild/linux-x64",
        "version": "0.27.7",
        "dev": true
      },
      {
        "name": "@esbuild/netbsd-arm64",
        "version": "0.27.7",
        "dev": true
      },
      {
        "name": "@esbuild/netbsd-x64",
        "version": "0.27.7",
        "dev": true
      },
      {
        "name": "@esbuild/openbsd-arm64",
        "version": "0.27.7",
        "dev": true
      },
      {
        "name": "@esbuild/openbsd-x64",
        "version": "0.27.7",
        "dev": true
      },
      {
        "name": "@esbuild/openharmony-arm64",
        "version": "0.27.7",
        "dev": true
      },
      {
        "name": "@esbuild/sunos-x64",
        "version": "0.27.7",
        "dev": true
      },
      {
        "name": "@esbuild/win32-arm64",
        "version": "0.27.7",
        "dev": true
      },
      {
        "name": "@esbuild/win32-ia32",
        "version": "0.27.7",
        "dev": true
      },
      {
        "name": "@esbuild/win32-x64",
        "version": "0.27.7",
        "dev": true
      },
      {
        "name": "@jridgewell/gen-mapping",
        "version": "0.3.13",
        "dev": true
      },
      {
        "name": "@jridgewell/resolve-uri",
        "version": "3.1.2",
        "dev": true
      },
      {
        "name": "@jridgewell/sourcemap-codec",
        "version": "1.6.0",
        "dev": true
      },
      {
        "name": "@jridgewell/trace-mapping",
        "version": "0.3.31",
        "dev": true
      },
      {
        "name": "@napi-rs/lzma-linux-x64-gnu",
        "version": "1.5.1",
        "dev": true
      },
      {
        "name": "@rollup/rollup-android-arm-eabi",
        "version": "4.64.0",
        "dev": true
      },
      {
        "name": "@rollup/rollup-android-arm64",
        "version": "4.64.0",
        "dev": true
      },
      {
        "name": "@rollup/rollup-darwin-arm64",
        "version": "4.64.0",
        "dev": true
      },
      {
        "name": "@rollup/rollup-darwin-x64",
        "version": "4.64.0",
        "dev": true
      },
      {
        "name": "@rollup/rollup-freebsd-arm64",
        "version": "4.64.0",
        "dev": true
      },
      {
        "name": "@rollup/rollup-freebsd-x64",
        "version": "4.64.0",
        "dev": true
      },
      {
        "name": "@rollup/rollup-linux-arm-gnueabihf",
        "version": "4.64.0",
        "dev": true
      },
      {
        "name": "@rollup/rollup-linux-arm-musleabihf",
        "version": "4.64.0",
        "dev": true
      },
      {
        "name": "@rollup/rollup-linux-arm64-gnu",
        "version": "4.64.0",
        "dev": true
      },
      {
        "name": "@rollup/rollup-linux-arm64-musl",
        "version": "4.64.0",
        "dev": true
      },
      {
        "name": "@rollup/rollup-linux-loong64-gnu",
        "version": "4.64.0",
        "dev": true
      },
      {
        "name": "@rollup/rollup-linux-loong64-musl",
        "version": "4.64.0",
        "dev": true
      },
      {
        "name": "@rollup/rollup-linux-ppc64-gnu",
        "version": "4.64.0",
        "dev": true
      },
      {
        "name": "@rollup/rollup-linux-ppc64-musl",
        "version": "4.64.0",
        "dev": true
      },
      {
        "name": "@rollup/rollup-linux-riscv64-gnu",
        "version": "4.64.0",
        "dev": true
      },
      {
        "name": "@rollup/rollup-linux-riscv64-musl",
        "version": "4.64.0",
        "dev": true
      },
      {
        "name": "@rollup/rollup-linux-s390x-gnu",
        "version": "4.64.0",
        "dev": true
      },
      {
        "name": "@rollup/rollup-linux-x64-gnu",
        "version": "4.64.0",
        "dev": true
      },
      {
        "name": "@rollup/rollup-linux-x64-musl",
        "version": "4.64.0",
        "dev": true
      },
      {
        "name": "@rollup/rollup-openbsd-x64",
        "version": "4.64.0",
        "dev": true
      },
      {
        "name": "@rollup/rollup-openharmony-arm64",
        "version": "4.64.0",
        "dev": true
      },
      {
        "name": "@rollup/rollup-win32-arm64-msvc",
        "version": "4.64.0",
        "dev": true
      },
      {
        "name": "@rollup/rollup-win32-ia32-msvc",
        "version": "4.64.0",
        "dev": true
      },
      {
        "name": "@rollup/rollup-win32-x64-gnu",
        "version": "4.64.0",
        "dev": true
      },
      {
        "name": "@rollup/rollup-win32-x64-msvc",
        "version": "4.64.0",
        "dev": true
      },
      {
        "name": "@types/body-parser",
        "version": "1.19.6",
        "dev": true
      },
      {
        "name": "@types/connect",
        "version": "3.4.38",
        "dev": true
      },
      {
        "name": "@types/estree",
        "version": "1.0.9",
        "dev": true
      },
      {
        "name": "@types/express",
        "version": "4.17.25",
        "dev": true
      },
      {
        "name": "@types/express-serve-static-core",
        "version": "4.19.9",
        "dev": true
      },
      {
        "name": "@types/http-errors",
        "version": "2.0.5",
        "dev": true
      },
      {
        "name": "@types/mime",
        "version": "1.3.5",
        "dev": true
      },
      {
        "name": "@types/node",
        "version": "20.19.43",
        "dev": true
      },
      {
        "name": "@types/qs",
        "version": "6.15.1",
        "dev": true
      },
      {
        "name": "@types/range-parser",
        "version": "1.2.7",
        "dev": true
      },
      {
        "name": "@types/send",
        "version": "0.17.6",
        "dev": true
      },
      {
        "name": "@types/send",
        "version": "1.2.1",
        "dev": true
      },
      {
        "name": "@types/serve-static",
        "version": "1.15.10",
        "dev": true
      },
      {
        "name": "accepts",
        "version": "1.3.8",
        "dev": true
      },
      {
        "name": "acorn",
        "version": "8.18.0",
        "dev": true
      },
      {
        "name": "any-promise",
        "version": "1.3.0",
        "dev": true
      },
      {
        "name": "array-flatten",
        "version": "1.1.1",
        "dev": true
      },
      {
        "name": "body-parser",
        "version": "1.20.8",
        "dev": true
      },
      {
        "name": "bundle-require",
        "version": "5.1.0",
        "dev": true
      },
      {
        "name": "bytes",
        "version": "3.1.2",
        "dev": true
      },
      {
        "name": "cac",
        "version": "6.7.14",
        "dev": true
      },
      {
        "name": "call-bind-apply-helpers",
        "version": "1.0.2",
        "dev": true
      },
      {
        "name": "call-bound",
        "version": "1.0.4",
        "dev": true
      },
      {
        "name": "chokidar",
        "version": "4.0.3",
        "dev": true
      },
      {
        "name": "commander",
        "version": "4.1.1",
        "dev": true
      },
      {
        "name": "confbox",
        "version": "0.1.8",
        "dev": true
      },
      {
        "name": "consola",
        "version": "3.4.2",
        "dev": true
      },
      {
        "name": "content-disposition",
        "version": "0.5.4",
        "dev": true
      },
      {
        "name": "content-type",
        "version": "1.0.5",
        "dev": true
      },
      {
        "name": "cookie",
        "version": "0.7.2",
        "dev": true
      },
      {